{
  "$schema": "https://json-schema.org/draft/2020-12/schema",
  "additionalProperties": false,
  "properties": {
    "baseline_evidence_ids": {
      "items": {
        "format": "uuid",
        "type": "string"
      },
      "minItems": 1,
      "title": "Baseline Evidence Ids",
      "type": "array"
    },
    "deadline_at": {
      "pattern": "^\\d{4}-\\d{2}-\\d{2}T\\d{2}:\\d{2}:\\d{2}(\\.\\d+)?Z$",
      "title": "Deadline At",
      "type": "string"
    },
    "job_id": {
      "format": "uuid",
      "title": "Job Id",
      "type": "string"
    },
    "org_id": {
      "format": "uuid",
      "title": "Org Id",
      "type": "string"
    },
    "plan_id": {
      "format": "uuid",
      "title": "Plan Id",
      "type": "string"
    },
    "plan_sha256": {
      "pattern": "^[a-f0-9]{64}$",
      "title": "Plan Sha256",
      "type": "string"
    },
    "request_id": {
      "format": "uuid",
      "title": "Request Id",
      "type": "string"
    },
    "safety_contract_ids": {
      "items": {
        "format": "uuid",
        "type": "string"
      },
      "minItems": 1,
      "title": "Safety Contract Ids",
      "type": "array"
    },
    "schema_version": {
      "const": "1.0.0",
      "title": "Schema Version",
      "type": "string"
    }
  },
  "required": [
    "schema_version",
    "org_id",
    "job_id",
    "request_id",
    "plan_id",
    "plan_sha256",
    "baseline_evidence_ids",
    "safety_contract_ids",
    "deadline_at"
  ],
  "title": "SimulationCommand",
  "type": "object"
}
