{
  "baseline_evidence_ids": [
    "00000000-0000-0000-0000-000000000004"
  ],
  "deadline_at": "2026-10-29T00:00:00Z",
  "job_id": "00000000-0000-0000-0000-000000000002",
  "org_id": "00000000-0000-0000-0000-000000000001",
  "plan_id": "00000000-0000-0000-0000-00000000000e",
  "plan_sha256": "1111111111111111111111111111111111111111111111111111111111111111",
  "request_id": "00000000-0000-0000-0000-000000000006",
  "safety_contract_ids": [
    "00000000-0000-0000-0000-00000000000f"
  ],
  "schema_version": "1.0.0"
}
